{
  "campaign_id": "weekly-2026-W31-pc",
  "completed_at": "2026-08-02T11:13:02.411610+00:00",
  "coverage_hash": "f41885c53407fff0ff730db2fd1ff290ad59b92bc733a7f8733bd68afb9f5921",
  "created_at": "2026-08-02T11:12:44.281518+00:00",
  "logic_version": "topic-intelligence-v2",
  "run_type": "WEEKLY_RESEARCH",
  "schema_version": 1,
  "site": "easy_pc_fix_guide",
  "state": "DONE",
  "updated_at": "2026-08-02T11:13:02.411610+00:00",
  "window_end": "2026-08-02",
  "window_start": "2025-08-02",
  "work_items": {
    "askubuntu-dualboot": {
      "attempts": 0,
      "cursor": "round-2-no-new-clusters",
      "discovered_ids": [
        "1068236"
      ],
      "last_error": "",
      "query_family": "dualboot-bluetooth-handoff",
      "required": true,
      "source": "ask_ubuntu",
      "state": "SATURATED",
      "updated_at": "2026-08-02T11:13:02.327662+00:00",
      "work_id": "askubuntu-dualboot"
    },
    "microsoft-answers-windows": {
      "attempts": 0,
      "cursor": "round-2-no-new-clusters",
      "discovered_ids": [
        "8d499f70-4f9d-4354-a2ca-165a0a258eb8"
      ],
      "last_error": "",
      "query_family": "com-ports-and-wrong-time",
      "required": true,
      "source": "microsoft_answers",
      "state": "SATURATED",
      "updated_at": "2026-08-02T11:13:02.276468+00:00",
      "work_id": "microsoft-answers-windows"
    },
    "quora-pc": {
      "attempts": 0,
      "cursor": "robots.txt",
      "discovered_ids": [],
      "last_error": "robots.txt blocked public access; optional source",
      "query_family": "windows-device-exceptions",
      "required": false,
      "source": "quora",
      "state": "BLOCKED",
      "updated_at": "2026-08-02T11:13:02.310749+00:00",
      "work_id": "quora-pc"
    },
    "reddit-pc-device-exceptions": {
      "attempts": 0,
      "cursor": "round-2-no-new-clusters",
      "discovered_ids": [
        "1be6arb"
      ],
      "last_error": "",
      "query_family": "com-ports-and-dualboot-bluetooth",
      "required": true,
      "source": "reddit",
      "state": "SATURATED",
      "updated_at": "2026-08-02T11:13:02.411610+00:00",
      "work_id": "reddit-pc-device-exceptions"
    },
    "search-console-all-queries": {
      "attempts": 0,
      "cursor": "all-queries-through-2026-08-02",
      "discovered_ids": [
        "sc-pc-12m"
      ],
      "last_error": "",
      "query_family": "all-first-party-queries",
      "required": true,
      "source": "google_search_console",
      "state": "DONE",
      "updated_at": "2026-08-02T11:13:02.295223+00:00",
      "work_id": "search-console-all-queries"
    },
    "superuser-windows": {
      "attempts": 0,
      "cursor": "round-2-no-new-clusters",
      "discovered_ids": [
        "1750581"
      ],
      "last_error": "",
      "query_family": "browser-print-queue",
      "required": true,
      "source": "superuser",
      "state": "SATURATED",
      "updated_at": "2026-08-02T11:13:02.386967+00:00",
      "work_id": "superuser-windows"
    }
  }
}
