{
  "campaign_id": "backfill-v2-20250801-20260731",
  "completed_at": "",
  "coverage_hash": "15aa1e36c4f9752ca6828f60947e2dd626519dce5b6798e670cf35009c157047",
  "created_at": "2026-08-02T12:06:06.697119+00:00",
  "logic_version": "topic-intelligence-v2",
  "run_type": "BACKFILL_RESEARCH",
  "schema_version": 1,
  "site": "korea_easy_guide",
  "state": "PAUSED",
  "updated_at": "2026-08-02T12:15:46.999480+00:00",
  "window_end": "2026-07-31",
  "window_start": "2025-08-01",
  "work_items": {
    "quora-korea": {
      "attempts": 0,
      "cursor": "",
      "discovered_ids": [],
      "last_error": "",
      "query_family": "korea-travel-and-daily-life",
      "required": false,
      "source": "quora",
      "state": "PENDING",
      "updated_at": "2026-08-02T12:06:06.697119+00:00",
      "work_id": "quora-korea"
    },
    "reddit-accommodation": {
      "attempts": 1,
      "cursor": "scout-opened-2-current-window-items-librarian-editor-auditor-pending",
      "discovered_ids": [
        "1uqosnf",
        "1tzekqd"
      ],
      "last_error": "",
      "query_family": "accommodation-checkin-booking",
      "required": true,
      "source": "reddit",
      "state": "PAUSED",
      "updated_at": "2026-08-02T12:15:46.999480+00:00",
      "work_id": "reddit-accommodation"
    },
    "reddit-apps-payments": {
      "attempts": 0,
      "cursor": "",
      "discovered_ids": [],
      "last_error": "",
      "query_family": "apps-payments-verification",
      "required": true,
      "source": "reddit",
      "state": "PENDING",
      "updated_at": "2026-08-02T12:06:06.697119+00:00",
      "work_id": "reddit-apps-payments"
    },
    "reddit-connectivity": {
      "attempts": 0,
      "cursor": "",
      "discovered_ids": [],
      "last_error": "",
      "query_family": "sim-esim-wifi-connectivity",
      "required": true,
      "source": "reddit",
      "state": "PENDING",
      "updated_at": "2026-08-02T12:06:06.697119+00:00",
      "work_id": "reddit-connectivity"
    },
    "reddit-food-delivery": {
      "attempts": 0,
      "cursor": "",
      "discovered_ids": [],
      "last_error": "",
      "query_family": "food-delivery-ordering",
      "required": true,
      "source": "reddit",
      "state": "PENDING",
      "updated_at": "2026-08-02T12:06:06.697119+00:00",
      "work_id": "reddit-food-delivery"
    },
    "reddit-transportation": {
      "attempts": 0,
      "cursor": "",
      "discovered_ids": [],
      "last_error": "",
      "query_family": "transportation-navigation-transit-cards",
      "required": true,
      "source": "reddit",
      "state": "PENDING",
      "updated_at": "2026-08-02T12:06:06.697119+00:00",
      "work_id": "reddit-transportation"
    },
    "reddit-travel-basics": {
      "attempts": 0,
      "cursor": "",
      "discovered_ids": [],
      "last_error": "",
      "query_family": "holidays-etiquette-emergency-basics",
      "required": true,
      "source": "reddit",
      "state": "PENDING",
      "updated_at": "2026-08-02T12:06:06.697119+00:00",
      "work_id": "reddit-travel-basics"
    },
    "search-console-all-queries": {
      "attempts": 0,
      "cursor": "",
      "discovered_ids": [],
      "last_error": "",
      "query_family": "all-first-party-queries",
      "required": true,
      "source": "search_console",
      "state": "PENDING",
      "updated_at": "2026-08-02T12:06:06.697119+00:00",
      "work_id": "search-console-all-queries"
    },
    "travel-stackexchange-korea": {
      "attempts": 0,
      "cursor": "",
      "discovered_ids": [],
      "last_error": "",
      "query_family": "travel-stackexchange-korea",
      "required": true,
      "source": "stack_exchange",
      "state": "PENDING",
      "updated_at": "2026-08-02T12:06:06.697119+00:00",
      "work_id": "travel-stackexchange-korea"
    }
  }
}
