{
  "campaign_id": "weekly-2026-W31-korea",
  "completed_at": "2026-08-02T11:13:02.382733+00:00",
  "coverage_hash": "dac98a20dfdc7a7c1617db9c968653995fd43e0914d56f009b7ae1f9568cfc20",
  "created_at": "2026-08-02T11:12:44.067085+00:00",
  "logic_version": "topic-intelligence-v2",
  "run_type": "WEEKLY_RESEARCH",
  "schema_version": 1,
  "site": "korea_easy_guide",
  "state": "DONE",
  "updated_at": "2026-08-02T11:13:02.382733+00:00",
  "window_end": "2026-08-02",
  "window_start": "2025-08-02",
  "work_items": {
    "quora-korea": {
      "attempts": 0,
      "cursor": "robots.txt",
      "discovered_ids": [],
      "last_error": "robots.txt blocked public access; optional source",
      "query_family": "korea-transport-payment-exceptions",
      "required": false,
      "source": "quora",
      "state": "BLOCKED",
      "updated_at": "2026-08-02T11:13:02.382733+00:00",
      "work_id": "quora-korea"
    },
    "reddit-korea-transport-payments": {
      "attempts": 0,
      "cursor": "round-2-no-new-clusters",
      "discovered_ids": [
        "1ij71tk"
      ],
      "last_error": "",
      "query_family": "ktx-tmoney-payment-exceptions",
      "required": true,
      "source": "reddit",
      "state": "SATURATED",
      "updated_at": "2026-08-02T11:13:02.292820+00:00",
      "work_id": "reddit-korea-transport-payments"
    },
    "search-console-all-queries": {
      "attempts": 0,
      "cursor": "all-queries-through-2026-08-02",
      "discovered_ids": [
        "sc-korea-12m"
      ],
      "last_error": "",
      "query_family": "all-first-party-queries",
      "required": true,
      "source": "google_search_console",
      "state": "DONE",
      "updated_at": "2026-08-02T11:13:02.277409+00:00",
      "work_id": "search-console-all-queries"
    },
    "travel-stackexchange-korea": {
      "attempts": 0,
      "cursor": "round-2-no-new-clusters",
      "discovered_ids": [
        "81276"
      ],
      "last_error": "",
      "query_family": "tmoney-arex-payment-exceptions",
      "required": true,
      "source": "stack_exchange",
      "state": "SATURATED",
      "updated_at": "2026-08-02T11:13:02.355033+00:00",
      "work_id": "travel-stackexchange-korea"
    }
  }
}
