{
  "campaign_id": "backfill-v2-20250801-20260731",
  "completed_at": "",
  "coverage_hash": "d87b4463e36f659511b3cd1cf1bf93cdd17f3c8ff19f1614f19ec56f1dd26b6b",
  "created_at": "2026-08-02T12:06:06.896836+00:00",
  "logic_version": "topic-intelligence-v2",
  "run_type": "BACKFILL_RESEARCH",
  "schema_version": 1,
  "site": "easy_pc_fix_guide",
  "state": "PENDING",
  "updated_at": "2026-08-02T12:06:06.896836+00:00",
  "window_end": "2026-07-31",
  "window_start": "2025-08-01",
  "work_items": {
    "askubuntu-dualboot": {
      "attempts": 0,
      "cursor": "",
      "discovered_ids": [],
      "last_error": "",
      "query_family": "dual-boot-and-shared-hardware",
      "required": true,
      "source": "ask_ubuntu",
      "state": "PENDING",
      "updated_at": "2026-08-02T12:06:06.896836+00:00",
      "work_id": "askubuntu-dualboot"
    },
    "microsoft-answers-windows": {
      "attempts": 0,
      "cursor": "",
      "discovered_ids": [],
      "last_error": "",
      "query_family": "windows-user-symptoms",
      "required": true,
      "source": "microsoft_answers",
      "state": "PENDING",
      "updated_at": "2026-08-02T12:06:06.896836+00:00",
      "work_id": "microsoft-answers-windows"
    },
    "quora-pc": {
      "attempts": 0,
      "cursor": "",
      "discovered_ids": [],
      "last_error": "",
      "query_family": "beginner-pc-problems",
      "required": false,
      "source": "quora",
      "state": "PENDING",
      "updated_at": "2026-08-02T12:06:06.896836+00:00",
      "work_id": "quora-pc"
    },
    "reddit-accounts-apps": {
      "attempts": 0,
      "cursor": "",
      "discovered_ids": [],
      "last_error": "",
      "query_family": "onedrive-account-apps-settings",
      "required": true,
      "source": "reddit",
      "state": "PENDING",
      "updated_at": "2026-08-02T12:06:06.896836+00:00",
      "work_id": "reddit-accounts-apps"
    },
    "reddit-boot-files": {
      "attempts": 0,
      "cursor": "",
      "discovered_ids": [],
      "last_error": "",
      "query_family": "boot-recovery-file-explorer-search",
      "required": true,
      "source": "reddit",
      "state": "PENDING",
      "updated_at": "2026-08-02T12:06:06.896836+00:00",
      "work_id": "reddit-boot-files"
    },
    "reddit-devices": {
      "attempts": 0,
      "cursor": "",
      "discovered_ids": [],
      "last_error": "",
      "query_family": "printer-scanner-audio-microphone",
      "required": true,
      "source": "reddit",
      "state": "PENDING",
      "updated_at": "2026-08-02T12:06:06.896836+00:00",
      "work_id": "reddit-devices"
    },
    "reddit-network": {
      "attempts": 0,
      "cursor": "",
      "discovered_ids": [],
      "last_error": "",
      "query_family": "wifi-internet-bluetooth",
      "required": true,
      "source": "reddit",
      "state": "PENDING",
      "updated_at": "2026-08-02T12:06:06.896836+00:00",
      "work_id": "reddit-network"
    },
    "reddit-update-errors": {
      "attempts": 0,
      "cursor": "",
      "discovered_ids": [],
      "last_error": "",
      "query_family": "windows-update-error-codes",
      "required": true,
      "source": "reddit",
      "state": "PENDING",
      "updated_at": "2026-08-02T12:06:06.896836+00:00",
      "work_id": "reddit-update-errors"
    },
    "search-console-all-queries": {
      "attempts": 0,
      "cursor": "",
      "discovered_ids": [],
      "last_error": "",
      "query_family": "all-first-party-queries",
      "required": true,
      "source": "search_console",
      "state": "PENDING",
      "updated_at": "2026-08-02T12:06:06.896836+00:00",
      "work_id": "search-console-all-queries"
    },
    "superuser-windows": {
      "attempts": 0,
      "cursor": "",
      "discovered_ids": [],
      "last_error": "",
      "query_family": "desktop-troubleshooting",
      "required": true,
      "source": "superuser",
      "state": "PENDING",
      "updated_at": "2026-08-02T12:06:06.896836+00:00",
      "work_id": "superuser-windows"
    }
  }
}
